{
  "contract_version": "1.0.0",
  "schema_version": "coinfox_curated_packet.v1",
  "packet_id": "cfpacket_market_pulse_20260627_fixture",
  "packet_type": "market_pulse_now",
  "generated_at": "2026-06-27T14:30:00Z",
  "generated_for": "coinfox",
  "author_display": "FoxClaw",
  "mode": "informational_paper",
  "disclosure": "Generated by FoxClaw for CoinFox. Public links and summaries only. Not individualized advice.",
  "source_window": {
    "started_at": "2026-06-26T14:30:00Z",
    "ended_at": "2026-06-27T14:30:00Z",
    "summary": "Manual beta fixture covering social heat, prediction-market movement, and public market context.",
    "private_lineage_excluded": true
  },
  "supported_commands": [
    "market_pulse_now",
    "idea_board_now",
    "what_changed_since_yesterday"
  ],
  "cards": [
    {
      "card_id": "cfcard_wen_social_spark_fixture",
      "card_type": "idea_prompt",
      "title": "WEN retail attention is becoming a thesis candidate",
      "asset_or_topic": "WEN",
      "tags": ["social_spark", "retail_heat", "needs_evidence"],
      "source_quality": {
        "trust_tier": "tier_3_social_crowd_signal",
        "display_label": "Social heat only",
        "confidence_score": 42,
        "terms_status": "aggregate_only"
      },
      "source_links": [
        {
          "source_name": "CoinFox Manual Market Pulse Board",
          "source_url": "https://coinfox.foxclaw.cloud/",
          "source_type": "community",
          "published_at": "2026-06-27T14:30:00Z",
          "link_required": true
        }
      ],
      "why_interesting": "Retail attention can appear before a mainstream narrative, but it needs hard evidence before it becomes a thesis.",
      "public_safe_summary": "WEN is a candidate for a CoinFox discussion prompt because social attention is rising around a possible turnaround or meme-stock story.",
      "counterpoint": "Social heat can fade quickly and does not prove price follow-through, valuation support, or business improvement.",
      "confidence": "low",
      "suggested_thesis_angle": "Is WEN only a social spark, or is there enough price, volume, filing, or leadership evidence to form a real thesis?",
      "suggested_coinfox_prompt": "What would make the WEN setup real enough to watch, and what would prove it was only heat?",
      "risk_flags": ["social_heat_not_evidence", "volatile_attention", "needs_primary_source"],
      "card_status": "watching",
      "outcome_memory": {
        "outcome_status": "unresolved",
        "review_after": "2026-07-04T14:30:00Z",
        "review_question": "Did social heat lead price and volume, or did the narrative fade?"
      },
      "safety": {
        "authority": "review_priority_only",
        "raw_content_included": false,
        "contains_private_source_content": false,
        "not_individualized_advice": true,
        "live_execution_allowed": false
      }
    },
    {
      "card_id": "cfcard_prediction_market_gap_fixture",
      "card_type": "market_pulse",
      "title": "Prediction-market odds shift needs source context",
      "asset_or_topic": "Prediction markets",
      "tags": ["odds_shift", "crowd_probability", "needs_context"],
      "source_quality": {
        "trust_tier": "tier_2_professional_news_data",
        "display_label": "Public market data",
        "confidence_score": 68,
        "terms_status": "summary_allowed"
      },
      "source_links": [
        {
          "source_name": "Kalshi",
          "source_url": "https://kalshi.com/",
          "source_type": "prediction_market",
          "published_at": "2026-06-27T14:30:00Z",
          "link_required": true
        }
      ],
      "why_interesting": "Odds moves can reveal changing crowd expectations before the surrounding news is easy to summarize.",
      "public_safe_summary": "A prediction-market move is worth a CoinFox prompt when probability changes faster than the public narrative explains.",
      "counterpoint": "Thin liquidity, sports/news timing, or market structure can make an odds move look more meaningful than it is.",
      "confidence": "medium",
      "suggested_thesis_angle": "What public information explains the probability move, and is the market reacting to real evidence or temporary flow?",
      "suggested_coinfox_prompt": "What changed in the odds, what public source explains it, and what would reverse the move?",
      "risk_flags": ["liquidity_check_needed", "source_context_needed"],
      "card_status": "heating_up",
      "outcome_memory": {
        "outcome_status": "unresolved",
        "review_after": "2026-06-30T14:30:00Z",
        "review_question": "Did the odds move anticipate public evidence or revert after thin flow?"
      },
      "safety": {
        "authority": "review_priority_only",
        "raw_content_included": false,
        "contains_private_source_content": false,
        "not_individualized_advice": true,
        "live_execution_allowed": false
      }
    },
    {
      "card_id": "cfcard_btc_macro_delta_fixture",
      "card_type": "delta",
      "title": "BTC discussion shifted from price chase to invalidation",
      "asset_or_topic": "BTC/USD",
      "tags": ["what_changed", "macro_watch", "risk_discussion"],
      "source_quality": {
        "trust_tier": "tier_2_professional_news_data",
        "display_label": "Public market context",
        "confidence_score": 61,
        "terms_status": "link_only"
      },
      "source_links": [
        {
          "source_name": "CoinFox Markets",
          "source_url": "https://coinfox.foxclaw.cloud/markets",
          "source_type": "market_data",
          "published_at": "2026-06-27T14:30:00Z",
          "link_required": true
        }
      ],
      "why_interesting": "A useful daily delta is not another headline; it shows how the market question changed.",
      "public_safe_summary": "The useful BTC prompt is moving from direction to conditions: what level, catalyst, or macro change would invalidate the current thesis?",
      "counterpoint": "A cleaner question does not mean the setup is tradeable or low risk.",
      "confidence": "medium",
      "suggested_thesis_angle": "Shift BTC discussion toward invalidation, evidence, and risk instead of chasing the latest candle.",
      "suggested_coinfox_prompt": "What changed since yesterday, and what would make your BTC view wrong?",
      "risk_flags": ["high_volatility", "plan_required", "not_a_trade_signal"],
      "card_status": "confirmed",
      "outcome_memory": {
        "outcome_status": "unresolved",
        "review_after": "2026-06-28T14:30:00Z",
        "review_question": "Did users name invalidation levels before the next major move?"
      },
      "safety": {
        "authority": "review_priority_only",
        "raw_content_included": false,
        "contains_private_source_content": false,
        "not_individualized_advice": true,
        "live_execution_allowed": false
      }
    }
  ],
  "status": {
    "authority": "review_priority_only",
    "can_submit_order": false,
    "can_move_funds": false,
    "live_execution_allowed": false,
    "can_change_truth": false,
    "can_promote_evidence": false,
    "can_change_source_reliability": false,
    "can_authorize_execution": false
  }
}
